{
  "id": "com.nginxui.dns01",
  "name": {
    "en": "DNS-01 Challenge",
    "zh_CN": "DNS-01 验证"
  },
  "description": {
    "en": "Solve the ACME DNS-01 challenge with any of the 224 DNS providers supported by lego.",
    "zh_CN": "通过 lego 支持的 224 个 DNS 服务商解决 ACME DNS-01 挑战。"
  },
  "author": "nginx-ui",
  "repository_url": "https://github.com/nginxui/plugin-dns01",
  "readme_url": "https://raw.githubusercontent.com/nginxui/plugin-dns01/main/README.md",
  "icon_url": "https://raw.githubusercontent.com/nginxui/plugin-dns01/main/webapp/public/icon.svg",
  "categories": [
    "acme",
    "dns"
  ],
  "capabilities": [
    "dns01"
  ],
  "license": "AGPL-3.0-only",
  "trust": "official",
  "stage": "production",
  "releases": [
    {
      "version": "1.0.0",
      "released_at": "2026-09-22T00:00:00Z",
      "api_version": 1,
      "min_nginx_ui_version": "2.7.0",
      "platforms": [
        "darwin-amd64",
        "darwin-arm64",
        "linux-amd64",
        "linux-arm64",
        "windows-amd64",
        "windows-arm64"
      ],
      "downloads": {
        "darwin-amd64": {
          "url": "https://github.com/nginxui/plugin-dns01/releases/download/v1.0.0/com.nginxui.dns01-1.0.0-darwin-amd64.tar.gz"
        },
        "darwin-arm64": {
          "url": "https://github.com/nginxui/plugin-dns01/releases/download/v1.0.0/com.nginxui.dns01-1.0.0-darwin-arm64.tar.gz"
        },
        "linux-amd64": {
          "url": "https://github.com/nginxui/plugin-dns01/releases/download/v1.0.0/com.nginxui.dns01-1.0.0-linux-amd64.tar.gz"
        },
        "linux-arm64": {
          "url": "https://github.com/nginxui/plugin-dns01/releases/download/v1.0.0/com.nginxui.dns01-1.0.0-linux-arm64.tar.gz"
        },
        "windows-amd64": {
          "url": "https://github.com/nginxui/plugin-dns01/releases/download/v1.0.0/com.nginxui.dns01-1.0.0-windows-amd64.tar.gz"
        },
        "windows-arm64": {
          "url": "https://github.com/nginxui/plugin-dns01/releases/download/v1.0.0/com.nginxui.dns01-1.0.0-windows-arm64.tar.gz"
        }
      },
      "release_notes_url": "https://github.com/nginxui/plugin-dns01/releases/tag/v1.0.0",
      "manifest": {
        "id": "com.nginxui.dns01",
        "name": "DNS-01 Challenge",
        "version": "1.0.0",
        "description": "Solve the ACME DNS-01 challenge with any of the DNS providers supported by lego.",
        "icon_path": "webapp/dist/icon.svg",
        "api_version": 1,
        "min_nginx_ui_version": "2.7.0",
        "server": {
          "executables": {
            "darwin-amd64": "server/dist/dns01-darwin-amd64",
            "darwin-arm64": "server/dist/dns01-darwin-arm64",
            "linux-amd64": "server/dist/dns01-linux-amd64",
            "linux-arm64": "server/dist/dns01-linux-arm64",
            "windows-amd64": "server/dist/dns01-windows-amd64.exe",
            "windows-arm64": "server/dist/dns01-windows-arm64.exe"
          },
          "lifecycle": "on_demand",
          "idle_timeout_seconds": 300
        },
        "webapp": {
          "bundle_path": "webapp/dist/main.js",
          "style_path": "webapp/dist/style.css",
          "shared": {
            "@vueuse/core": ">=15.0.0",
            "antdv-next": "~1.5",
            "pinia": ">=4.0.3 <5",
            "vue": ">=3.5.42 <4",
            "vue-router": ">=5.3.1 <6"
          }
        },
        "capabilities": [
          "dns01"
        ],
        "permissions": [
          "network"
        ],
        "settings_schema": {
          "settings": [
            {
              "key": "recursive_nameservers",
              "type": "text",
              "display_name": "Recursive nameservers",
              "help_text": "Comma separated host:port list used for the DNS propagation check. Empty means the system resolvers."
            },
            {
              "key": "default_propagation_timeout_seconds",
              "type": "number",
              "display_name": "Default propagation timeout (seconds)",
              "help_text": "Applied to providers that do not report a propagation timeout of their own.",
              "default": 120
            }
          ]
        }
      }
    }
  ]
}
